<?xml version="1.0" ?>
<xs:schema xmlns:xs="http://www.w3.org/2001/XMLSchema">
    <xs:element name="Interior-Design-Website">
        <xs:complexType>
            <xs:sequence>
                <xs:element name="Customer" maxOccurs="unbounded" minOccurs="1">
                    <xs:complexType>
                        <xs:sequence>
                            <xs:element name="C_ID" type="xs:string"/>
                            <xs:element name="Name" type="xs:string"/>
                            <xs:element name="Age" type="xs:int"/>
                            <xs:element name="Gender" type="xs:string"/>
                        </xs:sequence>
                    </xs:complexType>
                </xs:element>
                <xs:element name="Design" maxOccurs="unbounded" minOccurs="1">
                    <xs:complexType>
                        <xs:sequence>
                            <xs:element name="D_ID" type="xs:string"/>
                            <xs:element name="Price" type="xs:int"/>
                        </xs:sequence>
                    </xs:complexType>
                </xs:element>
            </xs:sequence>
        </xs:complexType>
    </xs:element>
</xs:schema>
